{
  "$schema": "https://json-schema.org/draft/2020-12/schema",
  "$id": "https://cliproot.com/schema/crp-v0.0.1.schema.json",
  "title": "ClipRoot Protocol (CRP) v0.0.1",
  "description": "Minimal protocol bundle schema for document, clipboard, and reuse-event exchanges.",
  "type": "object",
  "additionalProperties": false,
  "properties": {
    "protocolVersion": {
      "const": "0.0.1"
    },
    "bundleType": {
      "type": "string",
      "enum": [
        "document",
        "clipboard",
        "reuse-event"
      ]
    },
    "createdAt": {
      "$ref": "#/$defs/dateTime"
    },
    "document": {
      "$ref": "#/$defs/document"
    },
    "agents": {
      "type": "array",
      "items": {
        "$ref": "#/$defs/agent"
      },
      "default": []
    },
    "sources": {
      "type": "array",
      "items": {
        "$ref": "#/$defs/sourceRecord"
      },
      "default": []
    },
    "clips": {
      "type": "array",
      "items": {
        "$ref": "#/$defs/clip"
      },
      "default": []
    },
    "activities": {
      "type": "array",
      "items": {
        "$ref": "#/$defs/activity"
      },
      "default": []
    },
    "reuseEvents": {
      "type": "array",
      "items": {
        "$ref": "#/$defs/reuseEvent"
      },
      "default": []
    },
    "signatures": {
      "type": "array",
      "items": {
        "$ref": "#/$defs/signature"
      },
      "default": []
    }
  },
  "required": [
    "protocolVersion",
    "bundleType",
    "createdAt"
  ],
  "$defs": {
    "id": {
      "type": "string",
      "minLength": 1,
      "maxLength": 128,
      "pattern": "^[A-Za-z0-9._:-]+$"
    },
    "dateTime": {
      "type": "string",
      "format": "date-time"
    },
    "uri": {
      "type": "string",
      "format": "uri"
    },
    "sha256Base64Url": {
      "type": "string",
      "pattern": "^sha256-[A-Za-z0-9_-]{43,}$"
    },
    "document": {
      "type": "object",
      "additionalProperties": false,
      "properties": {
        "id": {
          "$ref": "#/$defs/id"
        },
        "uri": {
          "$ref": "#/$defs/uri"
        },
        "title": {
          "type": "string"
        },
        "canonicalHash": {
          "$ref": "#/$defs/sha256Base64Url"
        }
      },
      "required": [
        "id"
      ]
    },
    "agent": {
      "type": "object",
      "additionalProperties": false,
      "properties": {
        "id": {
          "$ref": "#/$defs/id"
        },
        "agentType": {
          "type": "string",
          "enum": [
            "person",
            "organization",
            "model",
            "service",
            "system"
          ]
        },
        "name": {
          "type": "string"
        },
        "uri": {
          "$ref": "#/$defs/uri"
        }
      },
      "required": [
        "id",
        "agentType"
      ]
    },
    "sourceRecord": {
      "type": "object",
      "additionalProperties": false,
      "properties": {
        "id": {
          "$ref": "#/$defs/id"
        },
        "sourceType": {
          "type": "string",
          "enum": [
            "human-authored",
            "ai-generated",
            "ai-assisted",
            "external-quoted",
            "unknown"
          ]
        },
        "digitalSourceType": {
          "$ref": "#/$defs/uri"
        },
        "title": {
          "type": "string"
        },
        "sourceUri": {
          "$ref": "#/$defs/uri"
        },
        "authorAgentId": {
          "$ref": "#/$defs/id"
        },
        "createdAt": {
          "$ref": "#/$defs/dateTime"
        }
      },
      "required": [
        "id",
        "sourceType"
      ]
    },
    "textPositionSelector": {
      "type": "object",
      "additionalProperties": false,
      "properties": {
        "start": {
          "type": "integer",
          "minimum": 0
        },
        "end": {
          "type": "integer",
          "minimum": 0
        }
      },
      "required": [
        "start",
        "end"
      ]
    },
    "textQuoteSelector": {
      "type": "object",
      "additionalProperties": false,
      "properties": {
        "exact": {
          "type": "string"
        },
        "prefix": {
          "type": "string"
        },
        "suffix": {
          "type": "string"
        }
      },
      "required": [
        "exact"
      ]
    },
    "domSelector": {
      "type": "object",
      "additionalProperties": false,
      "properties": {
        "provenanceAttribute": {
          "type": "string"
        },
        "elementId": {
          "type": "string"
        },
        "cssSelector": {
          "type": "string"
        },
        "classPath": {
          "type": "string"
        }
      },
      "minProperties": 1
    },
    "mediaTimeSelector": {
      "type": "object",
      "additionalProperties": false,
      "properties": {
        "startMs": {
          "type": "integer",
          "minimum": 0
        },
        "endMs": {
          "type": "integer",
          "minimum": 0
        },
        "track": {
          "type": "string",
          "enum": [
            "audio",
            "video"
          ]
        },
        "transcriptCueId": {
          "type": "string"
        }
      },
      "required": [
        "startMs",
        "endMs"
      ]
    },
    "clip": {
      "type": "object",
      "additionalProperties": false,
      "properties": {
        "id": {
          "$ref": "#/$defs/id"
        },
        "documentId": {
          "$ref": "#/$defs/id"
        },
        "sourceRefs": {
          "type": "array",
          "items": {
            "$ref": "#/$defs/id"
          },
          "minItems": 1,
          "uniqueItems": true
        },
        "selectors": {
          "type": "object",
          "additionalProperties": false,
          "properties": {
            "textPosition": {
              "$ref": "#/$defs/textPositionSelector"
            },
            "textQuote": {
              "$ref": "#/$defs/textQuoteSelector"
            },
            "editorPath": {
              "type": "string"
            },
            "dom": {
              "$ref": "#/$defs/domSelector"
            },
            "mediaTime": {
              "$ref": "#/$defs/mediaTimeSelector"
            }
          },
          "required": [
            "textPosition",
            "textQuote"
          ]
        },
        "textHash": {
          "$ref": "#/$defs/sha256Base64Url"
        },
        "createdByActivityId": {
          "$ref": "#/$defs/id"
        }
      },
      "required": [
        "id",
        "sourceRefs",
        "selectors",
        "textHash"
      ]
    },
    "activity": {
      "type": "object",
      "additionalProperties": false,
      "properties": {
        "id": {
          "$ref": "#/$defs/id"
        },
        "activityType": {
          "type": "string",
          "enum": [
            "create",
            "paste",
            "import",
            "edit",
            "ai_generate",
            "reuse_detected",
            "reuse_notified"
          ]
        },
        "agentId": {
          "$ref": "#/$defs/id"
        },
        "usedSourceRefs": {
          "type": "array",
          "items": {
            "$ref": "#/$defs/id"
          },
          "uniqueItems": true
        },
        "generatedClipRefs": {
          "type": "array",
          "items": {
            "$ref": "#/$defs/id"
          },
          "uniqueItems": true
        },
        "createdAt": {
          "$ref": "#/$defs/dateTime"
        }
      },
      "required": [
        "id",
        "activityType",
        "createdAt"
      ]
    },
    "reuseEvent": {
      "type": "object",
      "additionalProperties": false,
      "properties": {
        "id": {
          "$ref": "#/$defs/id"
        },
        "status": {
          "type": "string",
          "enum": [
            "detected",
            "notified",
            "acknowledged",
            "rejected"
          ]
        },
        "sourceDocumentId": {
          "$ref": "#/$defs/id"
        },
        "destinationDocumentId": {
          "$ref": "#/$defs/id"
        },
        "sourceRef": {
          "$ref": "#/$defs/id"
        },
        "detectedByActivityId": {
          "$ref": "#/$defs/id"
        },
        "createdAt": {
          "$ref": "#/$defs/dateTime"
        },
        "updatedAt": {
          "$ref": "#/$defs/dateTime"
        }
      },
      "required": [
        "id",
        "status",
        "sourceRef",
        "createdAt"
      ]
    },
    "signature": {
      "type": "object",
      "additionalProperties": false,
      "properties": {
        "id": {
          "$ref": "#/$defs/id"
        },
        "alg": {
          "type": "string",
          "enum": [
            "Ed25519",
            "ES256",
            "RS256"
          ]
        },
        "kid": {
          "type": "string"
        },
        "jws": {
          "type": "string"
        },
        "createdAt": {
          "$ref": "#/$defs/dateTime"
        }
      },
      "required": [
        "id",
        "alg",
        "jws"
      ]
    }
  }
}
